{
  "schema_version": 1,
  "pack_id": "fixture.synthetic.v1",
  "display_name": "TEST ONLY — synthetic prices",
  "currency": "USD",
  "valuation_as_of": "2026-08-01",
  "rates": [
    {"provider": "anthropic", "model": "synthetic-anthropic-v1", "channel": "api", "variant": "standard", "service_tier": "default", "context_band": "standard", "meter": "input.uncached", "valuation_date": "2026-08-01", "measurement_quality": "provider_reported", "unit": "million_tokens", "price": "3", "source": {"title": "Synthetic fixture source — not provider pricing", "url": "https://example.invalid/synthetic-pricing", "checked_at": "2026-08-01"}},
    {"provider": "anthropic", "model": "synthetic-anthropic-v1", "channel": "api", "variant": "standard", "service_tier": "default", "context_band": "standard", "meter": "input.cache_read", "valuation_date": "2026-08-01", "measurement_quality": "provider_reported", "unit": "million_tokens", "price": "0.3", "source": {"title": "Synthetic fixture source — not provider pricing", "url": "https://example.invalid/synthetic-pricing", "checked_at": "2026-08-01"}},
    {"provider": "anthropic", "model": "synthetic-anthropic-v1", "channel": "api", "variant": "standard", "service_tier": "default", "context_band": "standard", "meter": "output", "valuation_date": "2026-08-01", "measurement_quality": "provider_reported", "unit": "million_tokens", "price": "15", "source": {"title": "Synthetic fixture source — not provider pricing", "url": "https://example.invalid/synthetic-pricing", "checked_at": "2026-08-01"}},
    {"provider": "xai", "model": "synthetic-xai-v1", "channel": "api", "variant": "standard", "service_tier": "default", "context_band": "standard", "meter": "input.uncached", "valuation_date": "2026-08-01", "measurement_quality": "provider_reported", "unit": "million_tokens", "price": "2", "source": {"title": "Synthetic fixture source — not provider pricing", "url": "https://example.invalid/synthetic-pricing", "checked_at": "2026-08-01"}},
    {"provider": "xai", "model": "synthetic-xai-v1", "channel": "api", "variant": "standard", "service_tier": "default", "context_band": "standard", "meter": "input.cache_read", "valuation_date": "2026-08-01", "measurement_quality": "provider_reported", "unit": "million_tokens", "price": "0.5", "source": {"title": "Synthetic fixture source — not provider pricing", "url": "https://example.invalid/synthetic-pricing", "checked_at": "2026-08-01"}},
    {"provider": "xai", "model": "synthetic-xai-v1", "channel": "api", "variant": "standard", "service_tier": "default", "context_band": "standard", "meter": "output", "valuation_date": "2026-08-01", "measurement_quality": "provider_reported", "unit": "million_tokens", "price": "10", "source": {"title": "Synthetic fixture source — not provider pricing", "url": "https://example.invalid/synthetic-pricing", "checked_at": "2026-08-01"}},
    {"provider": "xai", "model": "synthetic-xai-v1", "channel": "api", "variant": "standard", "service_tier": "default", "context_band": "long", "meter": "input.uncached", "valuation_date": "2026-08-01", "measurement_quality": "provider_reported", "unit": "million_tokens", "price": "4", "source": {"title": "Synthetic fixture source — not provider pricing", "url": "https://example.invalid/synthetic-pricing", "checked_at": "2026-08-01"}},
    {"provider": "xai", "model": "synthetic-xai-v1", "channel": "api", "variant": "standard", "service_tier": "default", "context_band": "long", "meter": "input.cache_read", "valuation_date": "2026-08-01", "measurement_quality": "provider_reported", "unit": "million_tokens", "price": "1", "source": {"title": "Synthetic fixture source — not provider pricing", "url": "https://example.invalid/synthetic-pricing", "checked_at": "2026-08-01"}},
    {"provider": "xai", "model": "synthetic-xai-v1", "channel": "api", "variant": "standard", "service_tier": "default", "context_band": "long", "meter": "output", "valuation_date": "2026-08-01", "measurement_quality": "provider_reported", "unit": "million_tokens", "price": "20", "source": {"title": "Synthetic fixture source — not provider pricing", "url": "https://example.invalid/synthetic-pricing", "checked_at": "2026-08-01"}},
    {"provider": "cursor", "model": "synthetic-cursor-v1", "channel": "cloud-agent", "variant": "fast", "service_tier": "first-party", "context_band": "standard", "meter": "output", "valuation_date": "2026-08-01", "measurement_quality": "provider_reported", "unit": "million_tokens", "price": "6", "source": {"title": "Synthetic fixture source — not provider pricing", "url": "https://example.invalid/synthetic-pricing", "checked_at": "2026-08-01"}},
    {"provider": "cursor", "model": "synthetic-cursor-v1", "channel": "subscription", "variant": "standard", "service_tier": "first-party", "context_band": "standard", "meter": "input.uncached", "valuation_date": "2026-08-01", "measurement_quality": "derived", "unit": "million_tokens", "price": "4", "source": {"title": "Synthetic fixture source — not provider pricing", "url": "https://example.invalid/synthetic-pricing", "checked_at": "2026-08-01"}},
    {"provider": "cursor", "model": "synthetic-cursor-estimated-v1", "channel": "local-transcript", "variant": "standard", "service_tier": "unknown", "context_band": "standard", "meter": "input.uncached", "valuation_date": "2026-08-01", "measurement_quality": "estimated", "unit": "million_tokens", "price": "3", "source": {"title": "Synthetic fixture source — not provider pricing", "url": "https://example.invalid/synthetic-pricing", "checked_at": "2026-08-01"}}
  ]
}
